ID_Column,Column,Label,Label@nl,Label@fr,Comment,Comment@nl,Comment@de,Comment@fr,Definition,Definition@nl,Definition@de,Definition@fr,Attribute,attributeOf,Unit,Format,Time,Entity,Role,Relation,inRelationTo,wasDerivedFrom,wasGeneratedBy,Template
ID_AGEGROUP,AGEGROUP,Age group,,,,,,,Age group of confirmed cases,De leeftijdsgroep van bevestigde gevallen.,,La tranche d'âge des cas confirmés.,,,,,,,,,,,,
ID_DATE,DATE,Date,,,,,,,"Date of symptoms onset, sampling, diagnosis, or reporting (earliest available date is used and might be changed as new information becomes available)","De datum waarop symptomen begonnen, de datum van afname, diagnose of melding. De vroegst beschikbare datum wordt gebruikt en kan worden gewijzigd naarmate nieuwe informatie beschikbaar komt.",,"La date de début des symptômes, la date de prélèvement, de diagnostic ou de déclaration (la date la plus précoce disponible est utilisée et peut être modifiée à mesure que de nouvelles informations deviennent disponibles).",,,,,,,,,,,,
ID_CASES,CASES,Number of cases,,,,,,,Number of confirmed cases (combinations with zero cases are not shown),Aantal bevestigde gevallen (combinaties met nul gevallen worden niet getoond).,,Nombre de cas confirmés (les combinaisons avec zéro cas ne sont pas affichées).,,,,,,,,,,,,
ID_PROVINCE,PROVINCE,Province,,,,,,,Province of residence of confirmed cases (including Brussels),"De provincie waarin bevestigde gevallen wonen, inclusief Brussel.",,La province de résidence des cas confirmés (y compris Bruxelles).,,,,,,,,,,,,
ID_REGION,REGION,Region,,,,,,,Region of residence of confirmed cases,De regio van verblijf van bevestigde gevallen.,,La région de résidence des cas confirmés.,,,,,,,,,,,,
ID_SEX,SEX,Sex,,,,,,,Sex of confirmed cases,Het geslacht van bevestigde gevallen.,,Le sexe des cas confirmés.,,,,,,,,,,,,
