ID_Column,Column,Label,Label@nl,Label@fr,Comment,Comment@nl,Comment@de,Comment@fr,Definition,Definition@nl,Definition@de,Definition@fr,Attribute,attributeOf,Unit,Format,Time,Entity,Role,Relation,inRelationTo,wasDerivedFrom,wasGeneratedBy,Template,Column_type_variable,Column_personal_data,Column_sensitive_personal_data
ID_createdDate,createdDate,Date of creation for the ingredient category's entry.,,,,,,,The date when the ingredient category data was initially created.,De datum waarop de gegevens van de ingrediëntcategorie oorspronkelijk zijn gemaakt.,?,La date à laquelle les données de la catégorie d'ingrédient ont été initialement créées.,,,,,,,,,,,,,Date,No,No
ID_de,de,Information about the ingredient category,,,,,,,Information in German related to the ingredient category.,Informatie in het Duits met betrekking tot de ingrediëntcategorie.,?,Informations en allemand relatives à la catégorie d'ingrédient.,,,,,,,,,,,,,String,No,No
ID_deprecated,deprecated,Deprecated indicator for the ingredient category's entry.,,,,,,,Indicates whether the ingredient category is deprecated or no longer in use.,Geeft aan of de gegevensverzameling voor de ingrediëntcategorie verouderd of niet langer in gebruik is.,?,Indique si l'entrée du jeu de données pour la catégorie d'ingrédient est obsolète ou n'est plus en usage.,,,,,,,,,,,,,Boolean,No,No
ID_en,en,Information about the ingredient category,,,,,,,Information in English related to the ingredient category.,Informatie in het Engels met betrekking tot de ingrediëntcategorie.,?,Informations en anglais relatives à la catégorie d'ingrédient.,,,,,,,,,,,,,String,No,No
ID_fr,fr,Information about the ingredient category,,,,,,,Information in French related to the ingredient category.,Informatie in het Frans met betrekking tot de ingrediëntcategorie.,?,Informations en français relatives à la catégorie d'ingrédient.,,,,,,,,,,,,,String,No,No
ID_id,id,Unique identifier within the dataset 'Ingredient Category'.,,,,,,,A unique identifier within the 'Ingredient Category' dataset.,Een unieke identificatie binnen de dataset 'Ingredient Category'.,?,Un identifiant unique au sein du jeu de données 'Ingredient Category'.,,,,,,,,,,,,,String,No,No
ID_lastModifiedDate,lastModifiedDate,Latest modification timestamp for the ingredient category's entry.,,,,,,,The date when the ingredient category data was last modified.,De datum waarop de gegevens van de ingrediëntcategorie voor het laatst zijn gewijzigd.,?,La date à laquelle les données de la catégorie d'ingrédient ont été dernièrement modifiées.,,,,,,,,,,,,,Date,No,No
ID_nl,nl,Information about the ingredient category,,,,,,,Information in Dutch related to the ingredient category.,Informatie in het Nederlands met betrekking tot de ingrediëntcategorie.,?,Informations en néerlandais relatives à la catégorie d'ingrédient.,,,,,,,,,,,,,String,No,No
ID_version,version,Version is an indicator tracking ingredient category records updates.,,,,,,,"The version number refers to the specific iteration or edition of an entry within the 'Ingredient Category(ies)' dataset, denoting changes or updates made over time.","Het versienummer verwijst naar de specifieke iteratie of editie van een item binnen de ""Ingredient Category(ies)"" dataset, wat wijzigingen of updates aangeeft die in de loop der tijd zijn aangebracht.",?,"Le numéro de version fait référence à l'itération ou à l'édition spécifique d'une entrée dans l'ensemble de données ""Ingredient Category(s)"", indiquant les changements ou les mises à jour effectués au fil du temps.",,,,,,,,,,,,,Number,No,No
