ID_Column,Column,Label,Label@nl,Label@fr,Comment,Comment@nl,Comment@de,Comment@fr,Definition,Definition@nl,Definition@de,Definition@fr,Attribute,attributeOf,Unit,Format,Time,Entity,Role,Relation,inRelationTo,wasDerivedFrom,wasGeneratedBy,Template
ID_AGEGROUP,AGEGROUP,,,,,,,,The category or range into which the age of individuals receiving the vaccine falls,De leeftijdsgroep waarin de leeftijd van personen die het vaccin ontvangen valt,,La tranche d'âge des personnes recevant le vaccin,,,,,,,,,,,,
ID_CUMUL,CUMUL,,,,,,,,The total count of individuals who have received the vaccine up to the current point in time,Het totale aantal personen dat het vaccin heeft ontvangen tot het huidige moment,,Le nombre total de personnes ayant reçu le vaccin jusqu'à maintenant,,,,,,,,,,,,
ID_DOSE,DOSE,,,,,,,,A unique identifier for the dose of the vaccine administered,Een unieke identificatie voor de dosis van het toegediende vaccin,,Un identifiant unique pour la dose de vaccin administrée,,,,,,,,,,,,
ID_NIS5,NIS5,,,,,,,,The 5-digit code representing the municipality of residence for individuals receiving the vaccine,De 5-cijferige code die de gemeente van verblijf van personen die het vaccin ontvangen vertegenwoordigt,,Le code à 5 chiffres représentant la commune de résidence des personnes recevant le vaccin,,,,,,,,,,,,
ID_YEAR_WEEK,YEAR_WEEK,,,,,,,,"The period from Monday to Sunday, encompassing all vaccines administered and registered in Vaccinnet+ by the end of that week","De periode van maandag tot en met zondag, inclusief alle vaccins die zijn toegediend en geregistreerd in Vaccinnet+ tegen het einde van die week",,"La période du lundi au dimanche, incluant tous les vaccins administrés et enregistrés dans Vaccinnet+ à la fin de cette semaine",,,,,,,,,,,,
