ID_Column,Column,Label,Label@nl,Label@fr,Comment,Comment@nl,Comment@de,Comment@fr,Definition,Definition@nl,Definition@de,Definition@fr,Attribute,attributeOf,Unit,Format,Time,Entity,Role,Relation,inRelationTo,wasDerivedFrom,wasGeneratedBy,Template,Column_type_variable,Column_personal_data,Column_sensitive_personal_data
ID_deprecated,deprecated,Outdated indicator for the dataset  'ATC Code',,,,,,,An indicator of whether the entry in the 'ATC Code' dataset is outdated or no longer in use.,Een indicator of de vermelding in de dataset 'ATC Code' verouderd is of niet langer in gebruik is.,?,Un indicateur indiquant si l'entrée dans le jeu de données 'ATC Code' est obsolète ou n'est plus utilisée.,,,,,,,,,,,,,Boolean,No,No
ID_code,code,"Anatomical Therapeutic Classification (ATC) code from ""WHO""",,,,,,,An Anatomical Therapeutic Classification (ATC) code is a set of 6 letters and numbers issued by the World Health Organisation (WHO) that identifies and classifies an active substance according to its therapeutic use.,Een ATC-code (Anatomical Therapeutic Classification) is een set van 6 letters en cijfers uitgegeven door de Wereldgezondheidsorganisatie (WHO) die een werkzame stof identificeert en classificeert op basis van het therapeutische gebruik.,?,Un code ATC (Anatomical Therapeutic Classification) est un ensemble de 6 lettres et chiffres émis par l'Organisation mondiale de la santé (OMS) qui identifie et classe une substance active en fonction de son utilisation thérapeutique.,,,,,,,,,,,,,String,No,No
ID_createdDate,createdDate,Timestamp for ATC code creation in Pharmastatus.,,,,,,,The specific date and time when an ATC Code entry was initially created ( added to the ATC Code dataset) serving as a timestamp for its inception.,De specifieke datum en tijd waarop een ATC-code voor het eerst werd aangemaakt (toegevoegd aan de ATC Code dataset) en die dient als tijdstempel voor het begin ervan.,?,"La date et l'heure spécifiques auxquelles une entrée de code ATC a été initialement créée (ajoutée à l'ensemble de données des codes ATC), servant d'horodatage pour sa création.",,,,,,,,,,,,,Date,No,No
ID_en,en,English description of medication classification (ATC).,,,,,,,"The English-language description of the medication's therapeutic, anatomical, and chemical classification.","De beschrijving in de Engelse taal van de therapeutische, anatomische en chemische classificatie van het medicijn.",?,"La description en langue anglaise de la classification thérapeutique, anatomique et chimique du médicament.",,,,,,,,,,,,,String,No,No
ID_id,id,Unique ID for the ATC Code in the dataset.,,,,,,,"An unique identifier or reference number used to uniquely distinguish and categorize different ATC codes within the dataset, facilitating their classification and organization.","Een unieke identificatienummer of referentienummer dat wordt gebruikt om verschillende ATC-codes binnen de dataset uniek te onderscheiden en te categoriseren, wat hun classificatie en organisatie vergemakkelijkt.",?,"Un identifiant ou un numéro de référence unique utilisé pour distinguer de manière unique et catégoriser différents codes ATC dans le jeu de données, facilitant leur classification et leur organisation.",,,,,,,,,,,,,String,No,Yes
ID_lastModifiedDate,lastModifiedDate,Latest modification timestamp for ATC code creation in Pharmastatus.,,,,,,,"The specific date and time when a medication classification entry in the ATC Code dataset was most recently modified or updated, serving as a timestamp for its latest changes.","De specifieke datum en tijd waarop een invoer van medicatieclassificatie in de ATC Code dataset het meest recent is gewijzigd of bijgewerkt, als tijdstempel voor de laatste wijzigingen ervan.",?,"La date et l'heure spécifiques auxquelles une entrée de classification de médicaments dans le jeu de données ATC Code a été récemment modifiée ou mise à jour, servant de référence pour ses dernières modifications.",,,,,,,,,,,,,Date,No,No
ID_version,version,Version is an indicator tracking ATC code updates.,,,,,,,"The version number refers to the specific iteration or edition of an entry within the 'ATC Code(s)' dataset, denoting changes or updates made over time.","Het versienummer verwijst naar de specifieke iteratie of editie van een item binnen de 'ATC Code(s)' dataset, wat wijzigingen of updates aangeeft die in de loop der tijd zijn aangebracht.",?,"Le numéro de version fait référence à l'itération ou à l'édition spécifique d'une entrée dans l'ensemble de données ""ATC Code(s)"", indiquant les changements ou les mises à jour effectués au fil du temps.",,,,,,,,,,,,,Number,No,No
