ID_Column,Column,Label,Label@nl,Label@fr,Comment,Comment@nl,Comment@de,Comment@fr,Definition,Definition@nl,Definition@de,Definition@fr,Attribute,attributeOf,Unit,Format,Time,Entity,Role,Relation,inRelationTo,wasDerivedFrom,wasGeneratedBy,Template,Column_type_variable,Column_personal_data,Column_sensitive_personal_data
ID_createdDate,createdDate,Date of creation for the packaging content type entry.,,,,,,,The date when a packaging content type entry was originally created or added to the 'Pack Content Type' dataset.,De datum waarop een verpakkingstypevermelding oorspronkelijk is aangemaakt of toegevoegd aan de dataset 'Pack Content Type'.,?,La date à laquelle une entrée de type de contenu d'emballage a été initialement créée ou ajoutée à l'ensemble de données 'Pack Content Type'.,,,,,,,,,,,,,Date,No,No
ID_de,de,Packaging content description,,,,,,,The description or name of a type of content in a pack in German in the 'Pack Content Type' dataset.,De beschrijving of naam van een type inhoud in een pakket in het Duits in de dataset 'Pack Content Type'.,?,La description ou le nom d'un type de contenu dans un emballage en allemand dans l'ensemble de données 'Pack Content Type'.,,,,,,,,,,,,,String,No,No
ID_deprecated,deprecated,Deprecated indicator for the packaging content type.,,,,,,,A binary flag indicating whether a packaging content type is deprecated or no longer recommended for use.,Een binaire vlag die aangeeft of het item in de dataset voor een type verpakkingsinhoud verouderd is of niet langer wordt aanbevolen voor gebruik.,?,Un indicateur binaire indiquant si l'entrée dans le jeu de donnée d'un type de contenu d'emballage est obsolète ou n'est plus recommandé pour une utilisation.,,,,,,,,,,,,,Boolean,No,No
ID_en,en,Packaging content description,,,,,,,The description or name of a type of content in a pack in English in the 'Pack Content Type' dataset.,De beschrijving of naam van een verpakkingstype in het Engels binnen de dataset 'Pack Content Type'.,?,La description ou le nom d'un type de contenu dans un emballage en anglais dans l'ensemble de données 'Pack Content Type'.,,,,,,,,,,,,,String,No,No
ID_fr,fr,Packaging content description,,,,,,,The description or name of a type of content in a pack in English in the 'Pack Content Type' dataset.,De beschrijving of naam van een verpakkingstype in het Frans binnen de dataset 'Pack Content Type'.,?,La description ou le nom d'un type de contenu dans un emballage en francais dans l'ensemble de données 'Pack Content Type'.,,,,,,,,,,,,,String,No,No
ID_id,id,Unique numerical identifier within the dataset 'Pack Content Type'.,,,,,,,A unique numerical identifier associated with an entry in the 'Pack Content Type' dataset.,Een unieke numerieke identificatie gekoppeld aan een vermelding in de dataset 'Pack Content Type'.,?,Un identifiant numérique unique associé à une entrée dans l'ensemble de données 'Pack Content Type'.,,,,,,,,,,,,,String,No,No
ID_lastModifiedDate,lastModifiedDate,Latest modification timestamp for packaging content type entry.,,,,,,,"The date when a packaging content type entry was last modified or updated in the 'Pack Content Type' dataset, indicating the most recent changes.","De datum waarop een verpakkingstypevermelding voor het laatst is gewijzigd of bijgewerkt in de dataset 'Pack Content Type', waarbij de meest recente wijzigingen worden aangegeven.",?,"La date à laquelle une entrée de type de contenu d'emballage a été modifiée ou mise à jour pour la dernière fois dans l'ensemble de données 'Pack Content Type', indiquant les modifications les plus récentes.",,,,,,,,,,,,,Date,No,No
ID_nl,nl,Packaging content description,,,,,,,The description or name of a type of content in a pack in Dutch in the 'Pack Content Type' dataset.,De beschrijving of naam van een verpakkingstype in het Nederlands binnen de dataset 'Pack Content Type'.,?,La description ou le nom d'un type de contenu dans un emballage en néerlandais dans l'ensemble de données 'Pack Content Type'.,,,,,,,,,,,,,String,No,No
ID_version,version,Version is an indicator tracking pack content type updates.,,,,,,,"The version number refers to the specific iteration or edition of an entry within the 'Pack Content Type(s)' dataset, denoting changes or updates made over time.","Het versienummer verwijst naar de specifieke iteratie of editie van een item binnen de dataset ""Pack Content Type(s)"" en geeft wijzigingen of updates aan die in de loop der tijd zijn aangebracht.",?,"Le numéro de version fait référence à l'itération ou à l'édition spécifique d'une entrée dans l'ensemble de données ""Pack Content Type(s)"", indiquant les changements ou les mises à jour effectués au fil du temps.",,,,,,,,,,,,,Number,No,No
