ID_Column,Column,Label,Label@nl,Label@fr,Comment,Comment@nl,Comment@de,Comment@fr,Definition,Definition@nl,Definition@de,Definition@fr,Attribute,attributeOf,Unit,Format,Time,Entity,Role,Relation,inRelationTo,wasDerivedFrom,wasGeneratedBy,Template,Column_type_variable,Column_personal_data,Column_sensitive_personal_data
ID_createdDate,createdDate,Entry creation date of the dataset 'Commercialisation Stop'.,,,,,,,Date of entry creation in the 'Commercialisation Stop' dataset.,Datum van invoercreatie in het 'Commercialisation Stop' dataset.,?,Date de création de l'entrée dans le jeu de données 'Commercialisation Stop'.,,,,,,,,,,,,,Date,No,No
ID_deprecated,deprecated,Outdated indicator for the dataset 'Commercialisation Stop',,,,,,,An indicator of whether the entry in the Commercialisation Stop dataset is outdated or no longer in use.,Een indicator of de vermelding in de dataset 'Commercialisation Stop' verouderd is of niet langer in gebruik is.,?,Un indicateur indiquant si l'entrée dans le jeu de données d'arrêt de commercialisation est obsolète ou n'est plus utilisée.,,,,,,,,,,,,,Boolean,No,No
ID_id,id,Unique identifier for entries in Commercialisation Stop dataset.,,,,,,,"A unique identifier for each entry in the Commercialisation Stop dataset, facilitating data organization and retrieval.","Een unieke identificatie voor elke invoer in de dataset 'Commercialisation Stop', wat zorgt voor gegevensorganisatie en -terugvinding.",?,"Un identifiant unique pour chaque entrée dans le jeu de données des raisons d'arrêt de commercialisation, facilitant l'organisation et la récupération des données.",,,,,,,,,,,,,String,No,No
ID_lastModifiedDate,lastModifiedDate,Last entry modification date in dataset 'Commercialisation Stop'.,,,,,,,Date of the last modification of the entry in the dataset 'Commercialisation Stop'.,Datum van de laatste wijziging van de invoer in de dataset 'Commercialisation Stop'.,?,Date de la dernière modification de l'entrée dans le jeu de données 'Commercialisation Stop'.,,,,,,,,,,,,,Date,No,No
ID_en,en,Description of commercialization stop entry in dataset,,,,,,,Description in English of the entry in the Commercialisation Stop dataset. It gives a view on if the stop was temporary or definitive or deprecated (if no longer applicable). ,Beschrijving in het Engels van de vermelding in de dataset Commercialisation Stop. Het geeft aan of de stop tijdelijk of definitief was of afgeschreven (indien niet langer van toepassing). ,?,"Description en anglais de l'entrée dans l'ensemble de données Commercialisation Stop. Elle indique si l'arrêt était temporaire, définitif ou obsolète (si elle n'est plus applicable). ",,,,,,,,,,,,,String,No,No
ID_fr,fr,Description of commercialization stop entry in dataset,,,,,,,Description of the entry in the Commercialisation Stop dataset. It gives a view on if the stop was temporary or definitive or deprecated (if no longer applicable) in French. ,Beschrijving van de vermelding in de dataset Commercialiseringsstop. Het geeft aan of de stop tijdelijk of definitief was of afgeschreven (indien niet langer van toepassing) in Frans. ,?,"Description de l'entrée dans le jeu de données Commercialisation Stop. Elle indique si l'arrêt était temporaire, définitif ou obsolète (s'il n'est plus applicable) en français. ",,,,,,,,,,,,,String,No,No
ID_nl,nl,Description of commercialization stop entry in dataset,,,,,,,Description in English of the entry in the Commercialisation Stop dataset. It gives a view on if the stop was temporary or definitive or deprecated (if no longer applicable) in Dutch. ,Beschrijving van de vermelding in de dataset Commercialiseringsstop. Het geeft aan of de stop tijdelijk of definitief was of afgeschreven (indien niet langer van toepassing) in het Nederlands. ,?,"Description de l'entrée dans le jeu de données Commercialisation Stop. Elle indique si l'arrêt était temporaire, définitif ou obsolète (s'il n'est plus applicable) en néerlandais. ",,,,,,,,,,,,,String,No,No
ID_version,version,Version number of the entry in the dataset 'Commercialisation Stop'.,,,,,,,"The version number refers to the specific iteration or edition of an entry within the 'Commercialisation Stop(s)' dataset, denoting changes or updates made over time.","Het versienummer verwijst naar de specifieke iteratie of editie van een invoer binnen de dataset 'Commercialisation Stop', wat wijzigingen of updates in de loop van de tijd aangeeft.",?,"Le numéro de version fait référence à l'itération ou à l'édition spécifique d'une entrée dans l'ensemble de données ""Commercialisation Stop(s)"", indiquant les changements ou les mises à jour effectués au fil du temps.",,,,,,,,,,,,,Number,No,No
