ID_Column,Column,Label,Label@nl,Label@fr,Comment,Comment@nl,Comment@de,Comment@fr,Definition,Definition@nl,Definition@de,Definition@fr,Attribute,attributeOf,Unit,Format,Time,Entity,Role,Relation,inRelationTo,wasDerivedFrom,wasGeneratedBy,Template
ID_AGEGROUP,AGEGROUP,,,,,,,,The category or range into which the age of individuals receiving the vaccine falls,De leeftijdsgroep waarin de leeftijd van personen die het vaccin ontvangen valt,,La tranche d'âge des personnes recevant le vaccin,,,,,,,,,,,,
ID_DATE,DATE,,,,,,,,The specific date when the vaccine was given to an individual,De specifieke datum waarop het vaccin aan een persoon werd toegediend,,La date spécifique à laquelle le vaccin a été administré à une personne,,,,,,,,,,,,
ID_DOSE,DOSE,,,,,,,,A unique identifier for the dose of the vaccine administered,Een unieke identificatie voor de dosis van het toegediende vaccin,,Un identifiant unique pour la dose de vaccin administrée,,,,,,,,,,,,
ID_SEX,SEX,,,,,,,,The gender identity of individuals receiving the vaccine,Het geslacht van personen die het vaccin ontvangen,,Le sexe des personnes recevant le vaccin,,,,,,,,,,,,
ID_COUNT,COUNT,,,,,,,,"The count of individuals who have received the vaccine, excluding combinations with zero vaccinations","Het aantal personen dat het vaccin heeft ontvangen, exclusief combinaties met 0 vaccinaties",,Le nombre de personnes ayant reçu le vaccin (les combinaisons avec 0 vaccinations ne sont pas affichées),,,,,,,,,,,,
ID_REGION,REGION,,,,,,,,"The territorial area where individuals receiving the vaccine reside, with specific numbers for East Belgium excluded from Wallonia totals","Het territoriale gebied waar personen die het vaccin ontvangen wonen, met specifieke aantallen voor Oost België uitgesloten van de totalen voor Wallonië",,"La zone territoriale où résident les personnes recevant le vaccin, avec des chiffres spécifiques pour l'Est de la Belgique exclus des totaux de la Wallonie.",,,,,,,,,,,,
ID_BRAND,BRAND,,,,,,,,The specific brands or types of vaccines administered,De specifieke merken of typen vaccins die zijn toegediend,,Les marques spécifiques ou types de vaccins administrés,,,,,,,,,,,,
